"","X1","X2","X3","Data categorisation"
"689","Piva, JT, Dieckow, J, Bayer, C, Zanatta, JA, de Moraes, A, Pauletti, V, Tomazi, M, Pergher, M (2012) No-till reduces global warming potential in a subtropical Ferralsol","2012","http://dx.doi.org/10.1007/s11104-012-1244-1",NA
"690","Mishra, U, Torn, MS, Masanet, E, Ogle, SM (2012) Improving regional soil carbon inventories: Combining the IPCC carbon inventory method with regression kriging","2012","http://dx.doi.org/10.1016/j.geoderma.2012.06.022",NA
"692","Lenka, NK, Lal, R (2013) Soil aggregation and greenhouse gas flux after 15 years of wheat straw and fertilizer management in a no-till system","2013","http://dx.doi.org/10.1016/j.still.2012.08.011","15 yr field experiment"
"694","Stockmann, U, Adams, MA, Crawford, JW, Field, DJ, Henakaarchchi, N, Jenkins, M, Minasny, B, McBratney, AB, de Courcelles, VD, Singh, K, Wheeler, I, Abbott, L, Angers, DA, Baldock, J, Bird, M, Brookes, PC, Chenu, C, Jastrow, JD, Lal, R, Lehmann, J, O'Donnell, AG, Parton, WJ, Whitehead, D, Zimmermann, M (2013) The knowns, known unknowns and unknowns of sequestration of soil organic carbon","2013","http://dx.doi.org/10.1016/j.agee.2012.10.001",NA
"695","Ma, YC, Kong, XW, Yang, B, Zhang, XL, Yan, XY, Yang, JC, Xiong, ZQ (2013) Net global warming potential and greenhouse gas intensity of annual rice-wheat rotations with integrated soil-crop system management","2013","http://dx.doi.org/10.1016/j.agee.2012.11.003","2009-10"
"696","Robertson, F, Nash, D (2013) Limited potential for soil carbon accumulation using current cropping practices in Victoria, Australia","2013","http://dx.doi.org/10.1016/j.agee.2012.11.004","25 yrs"
"699","Leifeld, J, Angers, DA, Chenu, C, Fuhrer, J, Katterer, T, Powlson, DS (2013) Organic farming gives no climate change benefit through soil carbon sequestration","2013","http://dx.doi.org/10.1073/pnas.1220724110",NA
"701","Nguyen, TTH, Doreau, M, Eugene, M, Corson, MS, Garcia-Launay, F, Chesneau, G, van der Werf, HMG (2013) Effect of farming practices for greenhouse gas mitigation and subsequent alternative land use on environmental impacts of beef cattle production systems","2013","http://dx.doi.org/10.1017/S1751731112002200",NA
"702","Zhao, G, Bryan, BA, King, D, Luo, ZK, Wang, EL, Song, XD, Yu, Q (2013) Impact of agricultural management practices on soil organic carbon: simulation of Australian wheat systems","2013","http://dx.doi.org/10.1111/gcb.12145","122 years"
"703","Meki, MN, Kemanian, AR, Potter, SR, Blumenthal, JM, Williams, JR, Gerik, TJ (2013) Cropping system effects on sorghum grain yield, soil organic carbon, and global warming potential in central and south Texas","2013","http://dx.doi.org/10.1016/j.agsy.2013.01.004","100 years"
"704","Smith, LJ, Torn, MS (2013) Ecological limits to terrestrial biological carbon dioxide removal","2013","http://dx.doi.org/10.1007/s10584-012-0682-3",NA
"705","He, YJ, Qin, L, Li, ZY, Liang, XY, Shao, MX, Tan, L (2013) Carbon storage capacity of monoculture and mixed-species plantations in subtropical China","2013","http://dx.doi.org/10.1016/j.foreco.2013.01.020",NA
"706","Sierra, M, Martinez, FJ, Verde, R, Martin, FJ, Macias, F (2013) Soil-carbon sequestration and soil-carbon fractions, comparison between poplar plantations and corn crops in south-eastern Spain","2013","http://dx.doi.org/10.1016/j.still.2013.01.011",NA
"707","Zhao, GM, Sun, X, Ling, L, Liu, ZP (2013) Innovative Artificial Agro-Ecosystems Enhance Soil Carbon Sequestration in Coastal Zones of Southeast China","2013","http://dx.doi.org/10.1002/clen.201200391","3 years"
"709","Cui, J, Zhang, RJ, Bu, NS, Zhang, HB, Tang, BP, Li, ZL, Jiang, LF, Chen, JK, Fang, CM (2013) Changes in soil carbon sequestration and soil respiration following afforestation on paddy fields in north subtropical China","2013","http://dx.doi.org/10.1093/jpe/rts023",NA
"710","Lenka, NK, Sudhishri, S, Dass, A, Choudhury, PR, Lenka, S, Patnaik, US (2013) Soil carbon sequestration as affected by slope aspect under restoration treatments of a degraded alfisol in the Indian sub-tropics","2013","http://dx.doi.org/10.1016/j.geoderma.2013.04.009","2000-2006"
"712","Lai, LM, Li, YF, Tian, Y, Jiang, LH, Zhao, XC, Zhu, LH, Chen, X, Gao, Y, Wang, SM, Zheng, YR, Rimmington, GM (2013) Effects of Added Organic Matter and Water on Soil Carbon Sequestration in an Arid Region","2013","http://dx.doi.org/10.1371/journal.pone.0070224","June–October 2011"
"713","Noponen, MRA, Healey, JR, Soto, G, Haggar, JP (2013) Sink or source-The potential of coffee agroforestry systems to sequester atmospheric CO2 into soil organic carbon","2013","http://dx.doi.org/10.1016/j.agee.2013.04.012","9 years"
"714","Simansky, V (2013) Soil organic matter in water-stable aggregates under different soil management practices in a productive vineyard","2013","http://dx.doi.org/10.1080/03650340.2012.708103",NA
"715","Gollany, HT, Fortuna, AM, Samuel, MK, Young, FL, Pan, WL, Pecharko, M (2013) Soil Organic Carbon Accretion vs. Sequestration Using Physicochemical Fractionation and CQESTR Simulation","2013","http://dx.doi.org/10.2136/sssaj2012.0303",NA
"716","Lal, R (2013) Soil carbon management and climate change","2013","http://dx.doi.org/10.4155/CMT.13.31",NA
"717","Ericsson, N, Porso, C, Ahlgren, S, Nordberg, A, Sundberg, C, Hansson, PA (2013) Time-dependent climate impact of a bioenergy system - methodology development and application to Swedish conditions","2013","http://dx.doi.org/10.1111/gcbb.12031",NA
"718","DeLonge, MS, Ryals, R, Silver, WL (2013) A Lifecycle Model to Evaluate Carbon Sequestration Potential and Greenhouse Gas Dynamics of Managed Grasslands","2013","http://dx.doi.org/10.1007/s10021-013-9660-5","3- year"
"719","Deng, L, Wang, KB, Chen, ML, Shangguan, ZP, Sweeney, S (2013) Soil organic carbon storage capacity positively related to forest succession on the Loess Plateau, China","2013","http://dx.doi.org/10.1016/j.catena.2013.06.016",NA
"720","Tang, Z, Nan, ZB (2013) The potential of cropland soil carbon sequestration in the Loess Plateau, China","2013","http://dx.doi.org/10.1007/s11027-012-9397-z",NA
"721","Qin, ZC, Huang, Y, Zhuang, QL (2013) Soil organic carbon sequestration potential of cropland in China","2013","http://dx.doi.org/10.1002/gbc.20068","50 years"
"722","Liu, ZF, Lin, YB, Lu, HF, Ding, MM, Tan, YW, Xu, SJ, Fu, SL (2013) Maintenance of a Living Understory Enhances Soil Carbon Sequestration in Subtropical Orchards","2013","http://dx.doi.org/10.1371/journal.pone.0076950","10 years"
"723","Yu, YQ, Huang, Y, Zhang, W (2013) Projected changes in soil organic carbon stocks of China's croplands under different agricultural managements, 2011-2050","2013","http://dx.doi.org/10.1016/j.agee.2013.06.008","2010-2050"
"724","Pandey, D, Agrawal, M, Bohra, JS (2013) Impact of four tillage permutations in rice-wheat system on GHG performance of wheat cultivation through carbon footprinting","2013","http://dx.doi.org/10.1016/j.ecoleng.2013.07.020","2003-2009"
"725","Lugato, E, Panagos, P, Bampa, F, Jones, A, Montanarella, L (2014) A new baseline of organic carbon stock in European agricultural soils using a modelling approach","2014","http://dx.doi.org/10.1111/gcb.12292",NA
"726","Yang, XM, Drury, CF, Wander, MM (2013) A wide view of no-tillage practices and soil organic carbon sequestration","2013","http://dx.doi.org/10.1080/09064710.2013.816363",NA
"727","Loum, M, Viaud, V, Fouad, Y, Nicolas, H, Walter, C (2014) Retrospective and prospective dynamics of soil carbon sequestration in Sahelian agrosystems in Senegal","2014","http://dx.doi.org/10.1016/j.jaridenv.2013.10.007",NA
"728","Badgery, WB, Simmons, AT, Murphy, BM, Rawson, A, Andersson, KO, Lonergan, VE, van de Ven, R (2013) Relationship between environmental and land-use variables on soil carbon levels at the regional scale in central New South Wales, Australia","2013","http://dx.doi.org/10.1071/SR12358",NA
"729","Liu, DL, Anwar, MR, O'Leary, G, Conyers, MK (2014) Managing wheat stubble as an effective approach to sequester soil carbon in a semi-arid environment: Spatial modelling","2014","http://dx.doi.org/10.1016/j.geoderma.2013.10.003",NA
"730","Wiesmeier, M, Hubner, R, Sporlein, P, Geuss, U, Hangen, E, Reischl, A, von Lutzow, M, Schilling, B, Kogel-Knabner, I (2014) Carbon sequestration potential of soils in southeast Germany derived from stable soil organic carbon saturation","2014","http://dx.doi.org/10.1111/gcb.12384",NA
"732","ten Hoeve, M, Hutchings, NJ, Peters, GM, Svanstrom, M, Jensen, LS, Bruun, S (2014) Life cycle assessment of pig slurry treatment technologies for nutrient redistribution in Denmark","2014","http://dx.doi.org/10.1016/j.jenvman.2013.10.023",NA
"734","Zhang, HL, Lal, R, Zhao, X, Xue, JF, Chen, F (2014) Opportunities and Challenges of Soil Carbon Sequestration by Conservation Agriculture in China","2014","http://dx.doi.org/10.1016/B978-0-12-800138-7.00001-2","1990-2010"
"735","Tan, BC, Fan, JB, He, YQ, Luo, SM, Peng, XH (2014) Possible effect of soil organic carbon on its own turnover: A negative feedback","2014","http://dx.doi.org/10.1016/j.soilbio.2013.11.017",NA
"736","Xue, XB, Pang, YL, Landis, AE (2014) Evaluating agricultural management practices to improve the environmental footprint of corn-derived ethanol","2014","http://dx.doi.org/10.1016/j.renene.2013.12.026",NA
"737","Lorenz, K, Lal, R (2014) Soil organic carbon sequestration in agroforestry systems. A review","2014","http://dx.doi.org/10.1007/s13593-014-0212-y",NA
"738","Jiang, GY, Xu, MG, He, XH, Zhang, WJ, Huang, SM, Yang, XY, Liu, H, Peng, C, Shirato, Y, Iizumi, T, Wang, JZ, Murphy, DV (2014) Soil organic carbon sequestration in upland soils of northern China under variable fertilizer management and climate change scenarios","2014","http://dx.doi.org/10.1002/2013GB004746","upto 2100"
"739","Yang, HT, Li, XR, Wang, ZR, Jia, RL, Liu, LC, Chen, YL, Wei, YP, Gao, YH, Li, G (2014) Carbon sequestration capacity of shifting sand dune after establishing new vegetation in the Tengger Desert, northern China","2014","http://dx.doi.org/10.1016/j.scitotenv.2014.01.063",NA
"740","Dang, YA, Ren, W, Tao, B, Chen, GS, Lu, CQ, Yang, J, Pan, SF, Wang, GD, Li, SQ, Tian, HQ (2014) Climate and Land Use Controls on Soil Organic Carbon in the Loess Plateau Region of China","2014","http://dx.doi.org/10.1371/journal.pone.0095548","1961–2005"
"741","Mahmoodabadi, M, Heydarpour, E (2014) Sequestration of organic carbon influenced by the application of straw residue and farmyard manure in two different soils","2014","http://dx.doi.org/10.2478/intag-2014-0005",NA
"742","Hansen, VD, Nestlerode, JA (2014) Carbon sequestration in wetland soils of the northern Gulf of Mexico coastal region","2014","http://dx.doi.org/10.1007/s11273-013-9330-6",NA
"743","Gao, Y, He, NP, Yu, GR, Chen, WL, Wang, QF (2014) Long-term effects of different land use types on C, N, and P stoichiometry and storage in subtropical ecosystems: A case study in China","2014","http://dx.doi.org/10.1016/j.ecoleng.2014.03.013",NA
"744","Gelaw, AM, Singh, BR, Lal, R (2014) Soil organic carbon and total nitrogen stocks under different land uses in a semi-arid watershed in Tigray, Northern Ethiopia","2014","http://dx.doi.org/10.1016/j.agee.2014.02.035",NA
"745","Jin, Z, Dong, YS, Wang, YQ, Wei, XR, Wang, YF, Cui, BL, Zhou, WJ (2014) Natural vegetation restoration is more beneficial to soil surface organic and inorganic carbon sequestration than tree plantation on the Loess Plateau of China","2014","http://dx.doi.org/10.1016/j.scitotenv.2014.03.105",NA
"746","Srinivasarao, C, Lal, R, Kundu, S, Babu, MBBP, Venkateswarlu, B, Singh, AK (2014) Soil carbon sequestration in rainfed production systems in the semiarid tropics of India","2014","http://dx.doi.org/10.1016/j.scitotenv.2013.10.006",NA
"747","Poeplau, C, Don, A (2014) Soil carbon changes under Miscanthus driven by C-4 accumulation and C-3 decompostion - toward a default sequestration function","2014","http://dx.doi.org/10.1111/gcbb.12043",NA
"748","Qin, YB, Xin, ZB, Yu, XX, Xiao, YL (2014) Influence of Vegetation Restoration on Topsoil Organic Carbon in a Small Catchment of the Loess Hilly Region, China","2014","http://dx.doi.org/10.1371/journal.pone.0094489",NA
"749","Sperow, M (2014) An enhanced method for using the IPCC approach to estimate soil organic carbon storage potential on US agricultural soils","2014","http://dx.doi.org/10.1016/j.agee.2014.04.031",NA
"754","Gougoulias, C, Clark, JM, Shaw, LJ (2014) The role of soil microbes in the global carbon cycle: tracking the below-ground microbial processing of plant-derived carbon for manipulating carbon dynamics in agricultural systems","2014","http://dx.doi.org/10.1002/jsfa.6577",NA
"755","Manusch, C, Bugmann, H, Wolf, A (2014) The impact of climate change and its uncertainty on carbon storage in Switzerland","2014","http://dx.doi.org/10.1007/s10113-014-0586-z",NA
"756","Sommer, R, Bossio, D (2014) Dynamics and climate change mitigation potential of soil organic carbon sequestration","2014","http://dx.doi.org/10.1016/j.jenvman.2014.05.017","2014-2100"
"757","Chomel, M, DesRochers, A, Baldy, V, Larcheveque, M, Gauquelin, T (2014) Non-additive effects of mixing hybrid poplar and white spruce on aboveground and soil carbon storage in boreal plantations","2014","http://dx.doi.org/10.1016/j.foreco.2014.05.048",NA
"758","Powlson, DS, Stirling, CM, Jat, ML, Gerard, BG, Palm, CA, Sanchez, PA, Cassman, KG (2014) Limited potential of no-till agriculture for climate change mitigation","2014","http://dx.doi.org/10.1038/NCLIMATE2292",NA
"759","Yagasaki, Y, Shirato, Y (2014) Assessment on the rates and potentials of soil organic carbon sequestration in agricultural lands in Japan using a process-based model and spatially explicit land-use change inventories - Part 1: Historical trend and validation based on nation-wide soil monitoring","2014","http://dx.doi.org/10.5194/bg-11-4429-2014",NA
"760","Yagasaki, Y, Shirato, Y (2014) Assessment on the rates and potentials of soil organic carbon sequestration in agricultural lands in Japan using a process-based model and spatially explicit land-use change inventories - Part 2: Future potentials","2014","http://dx.doi.org/10.5194/bg-11-4443-2014","2007-2027"
"761","Shahidi, BMR, Dyck, M, Malhi, SS (2014) Carbon dioxide emissions from tillage of two long-term no-till Canadian prairie soils","2014","http://dx.doi.org/10.1016/j.still.2014.07.008",NA
"763","Mi, J, Liu, W, Yang, WH, Yan, J, Li, JQ, Sang, T (2014) Carbon sequestration by Miscanthus energy crops plantations in a broad range semi-arid marginal land in China","2014","http://dx.doi.org/10.1016/j.scitotenv.2014.07.047",NA
"764","Ashworth, AJ, Allen, FL, Wight, JP, Saxton, AM, Tyler, DD, Sams, CE (2014) Soil Organic Carbon Sequestration Rates under Crop Sequence Diversity, Bio-Covers, and No-Tillage","2014","http://dx.doi.org/10.2136/sssaj2013.09.0422",NA
"765","Lugato, E, Bampa, F, Panagos, P, Montanarella, L, Jones, A (2014) Potential carbon sequestration of European arable soils estimated by modelling a comprehensive set of management practices","2014","http://dx.doi.org/10.1111/gcb.12551","2100"
"766","Olsson, A, Campana, PE, Lind, M, Yan, JY (2014) Potential for carbon sequestration and mitigation of climate change by irrigation of grasslands","2014","http://dx.doi.org/10.1016/j.apenergy.2014.08.025",NA
"767","Shi, SW, Han, PF (2014) Estimating the soil carbon sequestration potential of China's Grain for Green Project","2014","http://dx.doi.org/10.1002/2014GB004924","2013-2050"
"768","Ryder, E, de Eyto, E, Dillane, M, Poole, R, Jennings, E (2014) Identifying the role of environmental drivers in organic carbon export from a forested peat catchment","2014","http://dx.doi.org/10.1016/j.scitotenv.2014.04.091",NA
"769","Grave, RA, Nicoloso, RD, Cassol, PC, Aita, C, Correa, JC, Dalla Costa, M, Fritz, DD (2015) Short-term carbon dioxide emission under contrasting soil disturbance levels and organic amendments","2015","http://dx.doi.org/10.1016/j.still.2014.10.010",NA
"770","DelVecchia, AG, Bruno, JF, Benninger, L, Alperin, M, Banerjee, O, Morales, JD (2014) Organic carbon inventories in natural and restored Ecuadorian mangrove forests","2014","http://dx.doi.org/10.7717/peerj.388",NA
"771","Makipaa, R, Linkosalo, T, Komarov, A, Makela, A (2015) Mitigation of climate change with biomass harvesting in Norway spruce stands: are harvesting practices carbon neutral?","2015","http://dx.doi.org/10.1139/cjfr-2014-0120",NA
"772","Yagioka, A, Komatsuzaki, M, Kaneko, N, Ueno, H (2015) Effect of no-tillage with weed cover mulching versus conventional tillage on global warming potential and nitrate leaching","2015","http://dx.doi.org/10.1016/j.agee.2014.09.011",NA
"773","Li, YQ, Zhao, XY, Zhang, FX, Awada, T, Wang, SK, Zhao, HL, Zhang, TH, Li, YL (2015) Accumulation of soil organic carbon during natural restoration of desertified grassland in China's Horqin Sandy Land","2015","http://dx.doi.org/10.1007/s40333-014-0045-1",NA
"774","Gu, CH, Crane, J, Hornberger, G, Carrico, A (2015) The effects of household management practices on the global warming potential of urban lawns","2015","http://dx.doi.org/10.1016/j.jenvman.2015.01.008",NA
"775","Lu, N, Akujarvi, A, Wu, X, Liski, J, Wen, ZM, Holmberg, M, Feng, XM, Zeng, Y, Fu, BJ (2015) Changes in soil carbon stock predicted by a process-based soil carbon model (Yasso07) in the Yanhe watershed of the Loess Plateau","2015","http://dx.doi.org/10.1007/s10980-014-0132-x",NA
"776","Islam, M, Dey, A, Rahman, M (2015) Effect of Tree Diversity on Soil Organic Carbon Content in the Homegarden Agroforestry System of North-Eastern Bangladesh","2015","http://dx.doi.org/10.1007/s11842-014-9275-5",NA
"778","Aguilera, E, Guzman, G, Alonso, A (2015) Greenhouse gas emissions from conventional and organic cropping systems in Spain. II. Fruit tree orchards","2015","http://dx.doi.org/10.1007/s13593-014-0265-y","20 years"
"779","Holmes, A, Muller, K, Clothier, B, Deurer, M (2015) Carbon Sequestration in Kiwifruit Orchard Soils at Depth to Mitigate Carbon Emissions","2015","http://dx.doi.org/10.1080/00103624.2014.988583","10-25 years to present"
"780","Lassaletta, L, Aguilera, E (2015) Soil carbon sequestration is a climate stabilization wedge: Comments on Sommer and Bossio (2014)","2015","http://dx.doi.org/10.1016/j.jenvman.2015.01.038",NA
"781","Drake, JA, Carrucan, A, Jackson, WR, Cavagnaro, TR, Patti, AF (2015) Biochar application during reforestation alters species present and soil chemistry","2015","http://dx.doi.org/10.1016/j.scitotenv.2015.02.012",NA
"782","Wang, WJ, Dalal, RC (2015) Nitrogen management is the key for low-emission wheat production in Australia: A life cycle perspective","2015","http://dx.doi.org/10.1016/j.eja.2015.02.007","2006-2009"
"783","Chaplot, V, Abdalla, K, Alexis, M, Bourennane, H, Darboux, F, Dlamini, P, Everson, C, Mchunu, C, Muller-Nedebock, D, Mutema, M, Quenea, K, Thenga, H, Chivenge, P (2015) Surface organic carbon enrichment to explain greater CO2 emissions from short-term no-tilled soils","2015","http://dx.doi.org/10.1016/j.agee.2015.02.001",NA
"784","Negash, M, Kanninen, M (2015) Modeling biomass and soil carbon sequestration of indigenous agroforestry systems using CO2FIX approach","2015","http://dx.doi.org/10.1016/j.agee.2015.02.004",NA
"785","Chen, WY (2015) The role of urban green infrastructure in offsetting carbon emissions in 35 major Chinese cities: A nationwide estimate","2015","http://dx.doi.org/10.1016/j.cities.2015.01.005",NA
"786","Hemati, Z, Hossain, M, Emenike, CU, Rozainah, MZ (2015) Rate of Carbon Storage in Soil of Natural and Degraded Mangrove Forest in Peninsular Malaysia","2015","http://dx.doi.org/10.1002/clen.201400034",NA
"787","Chen, HX, Zhao, Y, Feng, H, Li, HJ, Sun, BH (2015) Assessment of climate change impacts on soil organic carbon and crop yield based on long-term fertilization applications in Loess Plateau, China","2015","http://dx.doi.org/10.1007/s11104-014-2332-1",NA
"788","Tian, K, Zhao, YC, Xu, XH, Hai, N, Huang, BA, Deng, WJ (2015) Effects of long-term fertilization and residue management on soil organic carbon changes in paddy soils of China: A meta-analysis","2015","http://dx.doi.org/10.1016/j.agee.2015.02.008","1980-2012"
"789","Wu, YP, Liu, SG, Tan, ZX (2015) Quantitative attribution of major driving forces on soil organic carbon dynamics","2015","http://dx.doi.org/10.1002/2014MS000361","current"
"790","Su, XK, Wu, Y, Dong, SK, Wen, L, Li, YY, Wang, XX (2015) Effects of grassland degradation and re-vegetation on carbon and nitrogen storage in the soils of the Headwater Area Nature Reserve on the Qinghai-Tibetan Plateau, China","2015","http://dx.doi.org/10.1007/s11629-014-3043-z","Current"
"791","Yang, B, Xiong, ZQ, Wang, JY, Xu, X, Huang, QW, Shen, QR (2015) Mitigating net global warming potential and greenhouse gas intensities by substituting chemical nitrogen fertilizers with organic fertilization strategies in rice-wheat annual rotation systems in China: A 3-year field experiment","2015","http://dx.doi.org/10.1016/j.ecoleng.2015.04.071","2011-2014"
"792","Henderson, BB, Gerber, PJ, Hilinski, TE, Falcucci, A, Ojima, DS, Salvatore, M, Conant, RT (2015) Greenhouse gas mitigation potential of the world's grazing lands: Modeling soil carbon and nitrogen fluxes of mitigation practices","2015","http://dx.doi.org/10.1016/j.agee.2015.03.029","2000 to future"
"793","Zhao, X, Xue, JF, Zhang, XQ, Kong, FL, Chen, F, Lal, R, Zhang, HL (2015) Stratification and Storage of Soil Organic Carbon and Nitrogen as Affected by Tillage Practices in the North China Plain","2015","http://dx.doi.org/10.1371/journal.pone.0128873","2001-present"
"794","Boca, A, Van Miegroet, H, Gruselle, MC (2014) Forest Overstory Effect on Soil Organic Carbon Storage: A Meta-analysis","2014","http://dx.doi.org/10.2136/sssaj2013.08.0332nafsc",NA
"795","Zucaro, A, Forte, A, Fagnano, M, Bastianoni, S, Basosi, R, Fierro, A (2015) Comparative Attributional Life Cycle Assessment of Annual and Perennial Lignocellulosic Feedstocks Production Under Mediterranean Climate for Biorefinery Framework","2015","http://dx.doi.org/10.1002/ieam.1604","2012-2015"
"796","Lacoste, M, Viaud, V, Michot, D, Walter, C (2015) Landscape-scale modelling of erosion processes and soil carbon dynamics under land-use and climate change in agroecosystems","2015","http://dx.doi.org/10.1111/ejss.12267","2010-2100"
"797","Zhang, F, Li, CS, Wang, Z, Glidden, S, Grogan, DS, Li, XX, Cheng, Y, Frolking, S (2015) Modeling impacts of management on farmland soil carbon dynamics along a climate gradient in Northwest China during 1981-2000","2015","http://dx.doi.org/10.1016/j.ecolmodel.2015.05.006","1981-2000"
"798","Liu, YL, Zhou, ZQ, Zhang, XX, Xu, X, Chen, H, Xiong, ZQ (2015) Net global warming potential and greenhouse gas intensity from the double rice system with integrated soil-crop system management: A three-year field study","2015","http://dx.doi.org/10.1016/j.atmosenv.2015.06.018",NA
"799","Henry, BK, Butler, D, Wiedemann, SG (2015) Quantifying carbon sequestration on sheep grazing land in Australia for life cycle assessment studies","2015","http://dx.doi.org/10.1071/RJ14109",NA
"800","Chen, ZD, Zhang, HL, Dikgwatlhe, SB, Xue, JF, Qiu, KC, Tang, HM, Chen, F (2015) Soil carbon storage and stratification under different tillage/residue-management practices in double rice cropping system","2015","http://dx.doi.org/10.1016/S2095-3119(15)61068-1",NA
"801","Wang, GC, Huang, Y, Zhang, W, Yu, YQ, Sun, WJ (2015) Quantifying carbon input for targeted soil organic carbon sequestration in China's croplands","2015","http://dx.doi.org/10.1007/s11104-015-2508-3",NA
"802","Cardinael, R, Chevallier, T, Barthes, BG, Saby, NPA, Parent, T, Dupraz, C, Bernoux, M, Chenu, C (2015) Impact of alley cropping agroforestry on stocks, forms and spatial distribution of soil organic carbon - A case study in a Mediterranean context","2015","http://dx.doi.org/10.1016/j.geoderma.2015.06.015","1995-present"
"803","Wiesmeier, M, Munro, S, Barthold, F, Steffens, M, Schad, P, Kogel-Knabner, I (2015) Carbon storage capacity of semi-arid grassland soils and sequestration potentials in northern China","2015","http://dx.doi.org/10.1111/gcb.12957","Current"
"804","Noormets, A, Epron, D, Domec, JC, McNulty, SG, Fox, T, Sun, G, King, JS (2015) Effects of forest management on productivity and carbon sequestration: A review and hypothesis","2015","http://dx.doi.org/10.1016/j.foreco.2015.05.019",NA
"805","Meyer, R, Cullen, BR, Johnson, IR, Eckard, RJ (2015) Process modelling to assess the sequestration and productivity benefits of soil carbon for pasture","2015","http://dx.doi.org/10.1016/j.agee.2015.07.024",NA
"806","Silva, RD, Barioni, LG, Albertini, TZ, Eory, V, Topp, CFE, Fernandes, FA, Moran, D (2015) Developing a nationally appropriate mitigation measure from the greenhouse gas GHG abatement potential from livestock production in the Brazilian Cerrado","2015","http://dx.doi.org/10.1016/j.agsy.2015.08.011","2006-2030"
"807","Zhao, X, Zhang, R, Xue, JF, Pu, C, Zhang, XQ, Liu, SL, Chen, F, Lal, R, Zhang, HL (2015) Management-Induced Changes to Soil Organic Carbon in China: A Meta-analysis","2015","http://dx.doi.org/10.1016/bs.agron.2015.06.002",NA
"808","Wang, P, Liu, YL, Li, LQ, Cheng, K, Zheng, JF, Zhang, XH, Zheng, JW, Joseph, S, Pan, GX (2015) Long-term rice cultivation stabilizes soil organic carbon and promotes soil microbial activity in a salt marsh derived soil chronosequence","2015","http://dx.doi.org/10.1038/srep15704",NA
"809","Ghaley, BB, Porter, JR (2014) Ecosystem function and service quantification and valuation in a conventional winter wheat production system with DAISY model in Denmark","2014","http://dx.doi.org/10.1016/j.ecoser.2014.09.010","current conditions"
