"","X1","X2","X3","Data categorisation"
"1","Renforth, P","2012","The potential of enhanced weathering in the UK",NA
"3","Schuiling & Krijgsman","2006","ENHANCED WEATHERING: AN EFFECTIVE AND CHEAP TOOL TO SEQUESTER CO2",NA
"4","Köhler et al.","2010","Geoengineering potential of artificially enhanced silicate weathering of olivine",NA
"5","Taylor et al.","2016","Enhanced weathering strategies for stabilizing climate and averting ocean acidification","2100"
"6","Hangx & Spiers","2009","Coastal spreading of olivine to control atmospheric CO2 concentrations: A critical analysis of viability","1990"
"7","ten Berge et al.","2012","Olivine Weathering in Soil, and Its Effects on Growth and Nutrient Uptake in Ryegrass (Lolium perenne L.): A Pot Experiment",NA
"8","Montserrat et al.","2017","Olivine Dissolution in Seawater: Implications for CO2 Sequestration through Enhanced Weathering in Coastal Environments",NA
"9","Hartmann & Kempe","2008","What is the maximum potential for CO2 sequestration by “stimulated” weathering on the global scale?",NA
"10","Hauck et al.","2016","Iron fertilisation and century-scale effects of open ocean dissolution of olivine in a simulated CO2 removal experiment",NA
"11","Köhler et al.","2013","Geoengineering impact of open ocean dissolution of olivine on atmospheric CO2, surface ocean pH and marine biology",NA
"12","Manning & Renforth","2013","Passive sequestration of atmospheric CO2 through coupled plant-mineral reactions in urban soils",NA
"13","Renforth et al","2011","Silicate Production and Availability for Mineral Carbonation",NA
"14","Morales-Fl´ores et al.","2011","Artificial weathering pools of calcium-rich industrial waste for CO2 sequestration",NA
"15","Wilson et al.","2009","Carbon Dioxide Fixation within Mine Wastes of Ultramafic-Hosted Ore Deposits: Examples from the Clinton Creek and Cassiar Chrysotile Deposits, Canada",NA
"16","House et al.","2007","Electrochemical Acceleration of Chemical Weathering as an Energetically Feasible Approach to Mitigating Anthropogenic Climate Change",NA
"17","Fujii, M, Yamasaki, A, Kakizawa, M, Yanagisawa, Y","2001","Reduction of CO2 emission by treatment of waste concrete via an artificial weathering process.",NA
"18","Hartmann, J, West, AJ, Renforth, P, Köhler, P, de la Rocha, C, Wolf-Gladrow, D, Dürr, HH, Scheffran, J","2013","Enhanced chemical weathering as a geoengineering strategy to reduce atmospheric carbon dioxide, supply nutrients, and mitigate ocean acidification",NA
"19","Röös,E., Bajzelj, B., Smith, P., Patel, M., Little, D., Garnett,T.","2017","Protein futures for Western Europe: potential land use and climate impacts in 2050","2050"
"20","Lautenbach, S., Jungandreas, A., Blankec, J., Lehstenc, V., Mühlner, S., Kühn, I., Volk, M.","2017","Trade-offs between plant species richness and carbon storage in the context of afforestation: Examples from afforestation scenarios in the Mulde Basin, Germany",NA
"21","Deng, Q., McMahon, D.E., Xiang, Y., Yu, C.L., Jackson,R.B., Hui, D.","2017","A global meta-analysis of soil phosphorus dynamics after afforestation",NA
"22","Harrell, S., Zhai, D.L., Trac, C.J., Zinda, J.A.","2017","Dual-function forests in the returning farmland to forest program andthe flexibility of environmental policy in China",NA
"23","Holmes, I., Kirby, K.R., Potvin, C.","2016","Agroforestry within REDD+: experiences of an indigenous EmberÃ¡ community in Panama",NA
"24","Rodriguez, L.G., Hogarth, N.J., Zhou, W., Xie, C., Zhang, K., Putzel, L.","2016","China's conversion of cropland to forest program: A systematic review of the environmental and socioeconomic effects",NA
"25","Cheng C.H., Y.S. Huang, O.V. Menyailo, and C.T. Chen","2016","Stand development and aboveground biomass carbon accumulation with cropland afforestation in Taiwan",NA
"26","Juan J. Monge, Henry L.Bryant, Jianbang Gan, James W. Richardson","2016","Land use and general equilibrium implications of a forest-based carbon sequestration policy in the United States","2050"
"27","Syktus and McAlpine","2016","More than carbon sequestration: Biophysical climate benefits of restored savanna woodlands","2056–2075 compared to 1986–2005"
"28","Sebastian Sonntag, Julia Pongratz, Christian H. Reick, and Hauke Schmidt","2016","Reforestation in a high-CO2 world-Higher mitigation potential than expected, lower adaptation potential than hoped for","2100"
"29","Yitong Yao, Xuhui Wang, Zhenzhong Zeng, Yongwen Liu, Shushi Peng, Zaichun Zhu, Shilong Piao","2016","The Effect of Afforestation on Soil Moisture Content in Northeastern China",NA
"30","Ulrich Kreidenweis, Florian Humpenöder, Miodrag Stevanovic, Benjamin Leon Bodirsky, Elmar Kriegler, Hermann Lotze-Campen and Alexander Popp","2016","Afforestation to mitigate climate change: impacts on food prices under consideration of albedo effects","2100"
"31","Kim, D., Lim, C. H., Song, C., Lee, W. K., Piao, D., Heo, S., & Jeon, S.","2016","Estimation of future carbon budget with climate change and reforestation scenario in North Korea","2050"
"32","Yibo Liu, Jingfeng Xiao, Weimin Ju, Ke Xu, Yanlian Zhou and Yuntai Zhao","2016","Recent trends in vegetation greenness in China significantly altered annual evapotranspiration and water yield","2000-2014"
"33","Long-Fei Chena, Zhi-Bin Hea, Xi Zhua, Jun Dua, Jun-Jun Yanga, Jing Lia","2016","Impacts of afforestation on plant diversity, soil properties, and soil organic carbon storage in a semi-arid grassland of northwestern China",NA
"34","Sharif A. Mukul, John Herbohn and Jennifer Firn","2016","Co-benefits of biodiversity and carbon sequestration from regenerating secondary forests in the Philippine uplands: implications for forest landscape restoration","2013"
"35","Connor, J. D., Bryan, B. A. & Nolan, M.","2016","Cap and trade policy for managing water competition from potential future carbon plantations","2050"
"36","Xiaoming Feng, Bojie Fu, Shilong Piao, Shuai Wang, Philippe Ciais, Zhenzhong Zeng, Yihe Lü, Yuan Zeng, Yue Li, Xiaohui Jiang & Bingfang Wu","2016","Revegetation in China's Loess Plateau is approaching sustainable water resource limits","2000-2010"
"37","FERNANDES, G. W.; COELHO, M. S.; MACHADO, R. B.; FERREIRA, M. E.; AGUIAR, L. M. de S.; DIRZO, R.; SCARIOT, A.; LOPES, C. R.","2016","Afforestation of savannas: an impending ecological disaster",NA
"38","Zhi-lian Gong, Ya Tang","2016","Impacts of reforestation on woody species composition, species diversity and community structure in dry-hot valley of the Jinsha River, southwestern China",NA
"39","Keryn I. Paul, Shaun C. Cunningham, Jacqueline R. England, Stephen H. Roxburgh, Noel D. Preece, Tom Lewis, Kim Brooksbank, Debbie F. Crawford, Philip J. Polglase","2016","Managing reforestation to sequester carbon, increase biodiversity potential and minimize loss of agricultural land","After 15 years"
"40","Spracklen, D. V., Righelato, R.","2015","Carbon storage and sequestration of re-growing montane forests in southern Ecuador",NA
"41","Haim, D., White, E.M., Alig, R.J.","2015","Agriculture Afforestation for Carbon Sequestration Under Carbon Markets in the United States: Leakage Behavior from Regional Allowance Programs",NA
"42","Kim, Taeyoung., Langpap, Christian","2015","Agricultural landowners' response to incentives for afforestation","100 years"
"43","Ovando, P., Oviedo, J.L., Campos, P.","2015","Measuring total social income of a stone pine afforestation in Huelva (Spain)",NA
"44","S.C. Cunningham, R. MacNally, P.J. Baker, T.R. Cavagnaro, J. Beringer, J.R. Thomson, R.M. Thompson","2015","Balancing the environmental benefits of reforestation in agricultural regions",NA
"45","Matzek, Puleston, Gunn","2015","Can carbon credits fund riparian forest restoration?",NA
"46","Megan C. Evans, Josie Carwardine, Rod J. Fensham, Don W. Butler, Kerrie A. Wilson, Hugh P. Possingham, Tara G.Martin","2015","Carbon farming via assisted natural regeneration as a cost-effective mechanism for restoring biodiversity in agricultural landscapes",NA
"47","Schwaab, J, Bavay, M, Davin, E, Hagedorn, F, Husler, F, Lehning, M, Schneebeli, M, Thurig, E, Bebi, P","2015","Carbon storage versus albedo change: radiative forcing of forest expansion in temperate mountainous regions of Switzerland","1985-1997"
"48","Papanastasis, V.P., Bautista, S., Chouvardas, D., Mantzanas, K., Papadimitriou, M., Mayor, A.G., Koukioumi, P., Papaioannou, A., Vallejo, R.V.","2015","Comparative Assessment of Goods and Services Provided By Grazing Regulation and Reforestation in Degraded Mediterranean Rangelands","2011"
"49","Lee, DK, Park, C, Tomlin, D","2015","Effects of land-use-change scenarios on terrestrial carbon stocks in South Korea","2006-2030"
"50","Wang, Y, Yan, XD, Wang, ZM","2015","Effects of regional afforestation on global climate","2100"
"51","Greaves, ED, Marin, Y, Visaez, F, Hernandez, JV","2015","FORESTRY PLANTATIONS OF Pinus caribaea IN VENEZUELA AS A SOLAR ENERGY COLLECTOR",NA
"52","Wear, DN, Coulston, JW","2015","From sink to source: Regional variation in US forest carbon futures","2013-2037"
"53","Humpenoder, F, Popp, A, Stevanovic, M, Muller, C, Bodirsky, BL, Bonsch, M, Dietrich, JP, Lotze-Campen, H, Weindl, I, Biewald, A, Rolinski, S","2015","Land-Use and Carbon Cycle Responses to Moderate Climate Change: Implications for Land-Based Mitigation?","1995-2100"
"54","Hanberry, BB, Kabrick, JM, He, HS","2015","Potential tree and soil carbon storage in a major historical floodplain forest with disrupted ecological function",NA
"55","Carswell, FE, Mason, NWH, Overton, JM, Price, R, Burrows, LE, Allen, RB","2015","Restricting new forests to conservation lands severely constrains carbon and biodiversity gains in New Zealand","no duration given, potential cumulative!!"
"56","Carwardine, J, Hawkins, C, Polglase, P, Possingham, HP, Reeson, A, Renwick, AR, Watts, M, Martin, TG","2015","Spatial Priorities for Restoring Biodiverse Carbon Forests","40 year time span"
"57","Summers, DM, Bryan, BA, Nolan, M, Hobbs, TJ","2015","The costs of reforestation: A spatial model of the costs of establishing environmental and carbon plantings",NA
"58","Maraseni, TN, Cockfield, G","2015","The financial implications of converting farmland to state-supported environmental plantings in the Darling Downs region, Queensland","2013"
"59","Shi, SW, Han, PF, Zhang, P, Ding, F, Ma, CL","2015","The Impact of Afforestation on Soil Organic Carbon Sequestration on the Qinghai Plateau, China",NA
"60","Locatelli, B, Catterall, CP, Imbach, P, Kumar, C, Lasco, R, Marin-Spiotta, E, Mercer, B, Powers, JS, Schwartz, N, Uriarte, M","2015","Tropical reforestation and climate change: beyond carbon",NA
"61","Veldman, JW, Overbeck, GE, Negreiros, D, Mahy, G, Le Stradic, S, Fernandes, GW, Durigan, G, Buisson, E, Putz, FE, Bond, WJ","2015","Where Tree Planting and Forest Expansion are Bad for Biodiversity and Ecosystem Services",NA
"62","R. A. Houghton, Brett Byers, Alexander A. Nassikas","2015","A role for tropical forests in stabilizing atmospheric CO2","2050"
"63","Peng, SS, Piao, SL, Zeng, ZZ, Ciais, P, Zhou, LM, Li, LZX, Myneni, RB, Yin, Y, Zeng, H","2014","Afforestation in China cools local land surface temperature",NA
"64","Schirmer, J, Bull, L","2014","Assessing the likelihood of widespread landholder adoption of afforestation and reforestation projects",NA
"65","Nielsen, A.S.E., Plantinga, A.J., Alig, R.J.","2014","Carbon sequestration through afforestation in the United States","-"
"66","de Wit, HA, Bryn, A, Hofgaard, A, Karstensen, J, Kvalevag, MM, Peters, GP","2014","Climate warming feedback from mountain birch forest expansion: reduced albedo dominates carbon uptake",NA
"67","Haase, D, Haase, A, Rink, D","2014","Conceptualizing the nexus between urban shrinkage and ecosystem services",NA
"68","Humpenoder, F, Popp, A, Dietrich, JP, Klein, D, Lotze-Campen, H, Bonsch, M, Bodirsky, BL, Weindl, I, Stevanovic, M, Muller, C","2014","Investigating afforestation and bioenergy CCS as climate change mitigation strategies","2000-2095"
"69","Li, BL, Song, ZL, Wang, HL, Li, ZM, Jiang, PK, Zhou, GM","2014","Lithological control on phytolith carbon sequestration in moso bamboo forests",NA
"70","Funk, JM, Field, CB, Kerr, S, Daigneault, A","2014","Modeling the impact of carbon farming on land use in a New Zealand landscape",NA
"71","Xiao, JF","2014","Satellite evidence for significant biophysical consequences of the ""Grain for Green"" Program on the Loess Plateau in China",NA
"72","Wang, Y, Yan, XD, Wang, ZM","2014","The biogeophysical effects of extreme afforestation in modeling future climate",NA
"73","Paiva, D.S., De Melo Gomes, G.A.M., Fernandez, L., Andrade, J.C.S.","2014","Voluntary carbon market and its contributions to sustainable development: Analysis of the Monte Pascoal-Pau Brazil Ecological Corridor",NA
"74","Haim, D, White, EM, Alig, RJ","2014","Permanence of agricultural afforestation for carbon sequestration under stylized carbon markets in the.US",NA
"75","Meyer, A, Tarvainen, L, Nousratpour, A, Bjork, RG, Ernfors, M, Grelle, A, Klemedtsson, AK, Lindroth, A, Rantfors, M, Rutting, T, Wallin, G, Weslien, P, Klemedtsson, L","2013","A fertile peatland forest does not constitute a major greenhouse gas sink",NA
"76","Ausseil, AGE, Dymond, JR, Kirschbaum, MUF, Andrew, RM, Parfitt, RL","2013","Assessment of multiple ecosystem services in New Zealand at the catchment scale",NA
"77","Simonit, S, Perrings, C","2013","Bundling ecosystem services in the Panama Canal watershed",NA
"78","Farley, KA, Bremer, LL, Harden, CP, Hartsig, J","2013","Changes in carbon storage under alternative land uses in biodiverse Andean grasslands: implications for payment for ecosystem services",NA
"79","Smith, LJ, Torn, MS","2013","Ecological limits to terrestrial biological carbon dioxide removal",NA
"80","Merry, K, Siry, J, Bettinger, P, Bowker, JM","2013","Efficient assessments of urban tree planting potential within or near the southern Piedmont region of the United States",NA
"81","Djanibekov, U, Djanibekov, N, Khamzina, A, Bhaduri, A, Lamers, JPA, Berg, E","2013","Impacts of innovative forestry land use on rural livelihood in a bimodal agricultural system in irrigated drylands",NA
"82","Wang, B, Wang, D, Niu, X","2013","Past, present and future forest resources in China and the implications for carbon sequestration dynamics","2008-2050"
"83","Davies, GM, Gray, A, Rein, G, Legg, CJ","2013","Peat consumption and carbon loss due to smouldering wildfire in a temperate peatland",NA
"84","Polglase, PJ, Reeson, A, Hawkins, CS, Paul, KI, Siggins, AW, Turner, J, Crawford, DF, Jovanovic, T, Hobbs, TJ, Opie, K, Carwardine, J, Almeida, A","2013","Potential for forest carbon plantings to offset greenhouse emissions in Australia: economics and constraints to implementation","2011-2050"
"85","Greve, M, Reyers, B, Lykke, AM, Svenning, JC","2013","Spatial optimization of carbon-stocking projects across Africa integrating stocking potential with co-benefits and feasibility",NA
"86","Gong, X, Liu, YQ, Li, QL, Wei, XH, Guo, XM, Niu, DK, Zhang, WY, Zhang, JX, Zhang, L","2013","Sub-tropic degraded red soil restoration: Is soil organic carbon build-up limited by nutrients supply",NA
"87","Song, ZL, Liu, HY, Li, BL, Yang, XM","2013","The production of phytolith-occluded carbon in China's forests: implications to biogeochemical carbon sequestration",NA
"88","Nijnik, M, Pajot, G, Moffat, AJ, Slee, B","2013","An economic analysis of the establishment of forest plantations in the United Kingdom to mitigate climatic change","2010"
"89","Paul, KI, Reeson, A, Polglase, PJ, Ritson, P","2013","Economic and employment implications of a carbon market for industrial plantation forestry","2011"
"90","Xu, ZL, Zhao, CY, Feng, ZD, Zhang, F, Sher, H, Wang, C, Peng, HH, Wang, Y, Zhao, Y, Wang, Y, Peng, SZ, Zheng, XL","2013","Estimating realized and potential carbon storage benefits from reforestation and afforestation under climate change: a case study of the Qinghai spruce forests in the Qilian Mountains, northwestern China","2008"
"91","Wang, YC, Lin, JC","2012","Air quality enhancement zones in Taiwan: A carbon reduction benefit assessment","current (2012)"
"92","Lindenmayer, DB, Hulvey, KB, Hobbs, RJ, Colyvan, M, Felton, A, Possingham, HP, Steffen, W, Wilson, K, Youngentob, K, Gibbons, P","2012","Avoiding bio-perversity from carbon sequestration solutions",NA
"93","Boucher, JF, Tremblay, P, Gaboury, S, Villeneuve, C","2012","Can boreal afforestation help offset incompressible GHG emissions from Canadian industries?","70 years"
"94","Rheinhardt, R.D., Brinson, M.M., Meyer, G.F., Miller, K.H.","2012","Carbon storage of headwater riparian zones in an agricultural landscape",NA
"95","Coelho, MB, Paulo, JA, Palma, JHN, Tome, M","2012","Contribution of cork oak plantations installed after 1990 in Portugal to the Kyoto commitments and to the landowners economy","2056"
"96","Suganuma, H., Egashira, Y., Utsugi, H., Kojima, T.","2012","Estimation of CO2 reduction amount by arid land afforestation in Western Australia","30 years"
"97","Paterson, S, Bryan, BA","2012","Food-Carbon Trade-offs between Agriculture and Reforestation Land Uses under Alternate Market-based Policies",NA
"98","Rissman, AR, Rittenhouse, CD","2012","Forest cover, carbon sequestration, and wildlife habitat: policy review and modeling of tradeoffs among land-use change scenarios",NA
"99","Huang, L, Shao, QQ, Liu, JY","2012","Forest restoration to achieve both ecological and economic progress, Poyang Lake basin, China",NA
"100","Townsend, PV, Harper, RJ, Brennan, PD, Dean, C, Wu, S, Smettem, KRJ, Cook, SE","2012","Multiple environmental services as an opportunity for watershed restoration",NA
"101","Raboin, ML, Posner, JL","2012","Pine or Pasture? Estimated Costs and Benefits of Land Use Change in the Peruvian Andes",NA
"102","Venter, M., Venter, O., Laurance, S., Bird, M.","2012","Recarbonization of the humid tropics",NA
"103","Chen, GS, Notaro, M, Liu, ZY, Liu, YQ","2012","Simulated Local and Remote Biophysical Effects of Afforestation over the Southeast United States in Boreal Summer",NA
"104","Berthrong, ST, Pineiro, G, Jobbagy, EG, Jackson, RB","2012","Soil C and N changes with afforestation of grasslands across gradients of precipitation and plantation age",NA
"105","Kaplan, JO, Krumhardt, KM, Zimmermann, NE","2012","The effects of land use and climate change on the carbon cycle of Europe over the past 500 years",NA
"106","Rytter, RM","2012","The potential of willow and poplar plantations as carbon sinks in Sweden",NA
"107","Hall, JM, Van Holt, T, Daniels, AE, Balthazar, V, Lambin, EF","2012","Trade-offs between tree cover, carbon storage and floristic biodiversity in reforesting landscapes",NA
"108","Mason, NWH, Ausseil, AGE, Dymond, JR, Overton, JM, Price, R, Carswell, FE","2012","Will use of non-biodiversity objectives to select areas for ecological restoration always compromise biodiversity gains?",NA
"109","Anderson, RG, Canadell, JG, Randerson, JT, Jackson, RB, Hungate, BA, Baldocchi, DD, Ban-Weiss, GA, Bonan, GB, Caldeira, K, Cao, L, Diffenbaugh, NS, Gurney, KR, Kueppers, LM, Law, BE, Luyssaert, S, O'Halloran, TL","2011","Biophysical considerations in forestry for climate protection",NA
"110","Arora, VK, Montenegro, A","2011","Small temperature benefits provided by realistic afforestation efforts","2011-2100"
"111","McKinley, DC, Ryan, MG, Birdsey, RA, Giardina, CP, Harmon, ME, Heath, LS, Houghton, RA, Jackson, RB, Morrison, JF, Murray, BC, Pataki, DE, Skog, KE","2011","A synthesis of current knowledge on forests and carbon storage in the United States",NA
"112","Pan, Y, Chen, JM, Birdsey, R, McCullough, K, He, L, Deng, F","2011","Age structure and disturbance legacy of North American forests",NA
"113","Caetano, MAL, Gherardi, DFM, Yoneyama, T","2011","An optimized policy for the reduction of CO2 emission in the Brazilian Legal Amazon",NA
"114","Zhu, Z., Bouchard, M., Butman, D., Hawbaker, T., Li, Z., Liu, J., Liu, S., McDonald, C., Reker, R., Sayler, K., Sleeter, B., Sohl, T., Stackpoole, S., Wein, A.","2011","Baseline and projected future carbon storage and greenhouse-gas fluxes in the great plains region of the United States",NA
"115","Crossman, ND, Bryan, BA, Summers, DM","2011","Carbon Payments and Low-Cost Conservation",NA
"116","Wang, YC","2011","Carbon sequestration and foliar dust retention by woody plants in the greenbelts along two major Taiwan highways",NA
"117","Wang, YF, Cao, SX","2011","Carbon Sequestration May Have Negative Impacts on Ecosystem Health",NA
"118","Wolf, S, Eugster, W, Potvin, C, Turner, BL, Buchmann, N","2011","Carbon sequestration potential of tropical pasture compared with afforestation in Panama",NA
"119","Gao, GL, Ding, GD, Wang, HY, Zang, YT, Liang, WJ","2011","China Needs Forest Management Rather Than Reforestation for Carbon Sequestration",NA
"120","Winsten, J, Walker, S, Brown, S, Grimland, S","2011","Estimating carbon supply curves from afforestation of agricultural land in the Northeastern US",NA
"121","Morani, A, Nowak, DJ, Hirabayashi, S, Calfapietra, C","2011","How to select the best tree planting locations to enhance air pollution removal in the MillionTreesNYC initiative",NA
"122","Jin, TT, Fu, BJ, Liu, GH, Wang, Z","2011","Hydrologic feasibility of artificial forestation in the semi-arid Loess Plateau of China",NA
"123","Kirschbaum, MUF, Whitehead, D, Dean, SM, Beets, PN, Shepherd, JD, Ausseil, AGE","2011","Implications of albedo changes following afforestation on the benefits of forests as carbon sinks",NA
"124","Dantas, STPL, Amaro, VE, Costa, BCP","2011","Mangrove Reforestation as a Mesotidal Coastal Protection and Clean Development Mechanism on Macau-Serra Oil Field, Potiguar Basin, Northeast Brazil",NA
"125","Kuemmerle, T, Olofsson, P, Chaskovskyy, O, Baumann, M, Ostapowicz, K, Woodcock, CE, Houghton, RA, Hostert, P, Keeton, WS, Radeloff, VC","2011","Post-Soviet farmland abandonment, forest recovery, and carbon sequestration in western Ukraine",NA
"126","Cantarello, E, Newton, AC, Hill, RA","2011","Potential effects of future land-use change on regional carbon stocks in the UK",NA
"127","Adams, DM, Alig, R, White, EM, Latta, G","2011","Regional Impacts of a Program for Private Forest Carbon Offset Sales",NA
"128","Buttle, JM","2011","Streamflow response to headwater reforestation in the Ganaraska River basin, southern Ontario, Canada",NA
"129","Schrobback, P, Adamson, D, Quiggin, J","2011","Turning Water into Carbon: Carbon Sequestration and Water Flow in the Murray-Darling Basin",NA
"130","Lenton, TM","2010","The potential for land-based biological CO2 removal to lower future atmospheric CO2 concentration","2050"
"133","Dominy, SWJ, Gilsenan, R, McKenney, DW, Allen, DJ, Hatton, T, Koven, A, Cary, J, Yemshanov, D, Sidders, D","2010","A retrospective and lessons learned from Natural Resources Canada's Forest 2020 afforestation initiative","2003"
"134","Ryan, M.G., Harmon, M.E., Birdsey, R.A., Giardina, C.P., Heath, L.S., Houghton, R.A., Jackson, R.B., McKinley, D.C., Morrison, J.F., Murray, B.C., Pataki, D.E., Skog, K.E.","2010","A synthesis of the science on forests and carbon for U.S. Forests","?"
"135","Torres, AB, Marchant, R, Lovett, JC, Smart, JCR, Tipper, R","2010","Analysis of the carbon sequestration costs of afforestation and reforestation agroforestry practices and the use of cost curves to evaluate their potential for implementation of climate change mitigation",NA
"136","Xu, B, Guo, ZD, Piao, SL, Fang, JY","2010","Biomass carbon stocks in China’s forests between 2000 and 2050: A prediction based on forest biomass-age relationships","2000–2050"
"137","Laganiere, J, Angers, DA, Pare, D","2010","Carbon accumulation in agricultural soils after afforestation: a meta-analysis","not applicable"
"138","Gorte, R.W.","2010","Carbon sequestration in forests","not applicable"
"139","Malmer, A, Murdiyarso, D, Bruijnzeel, LA, Ilstedt, U","2010","Carbon sequestration in tropical forests and water: a critical look at the basis for commonly used generalizations","not applicable"
"140","Lü, J., Yue, Q., Wang, Z., Zhang, G.","2010","Carbon sequestration potential in Fujian's forest ecosystems","2004-2050"
"141","Rootzen, JM, Berndes, G, Ravindranath, NH, Somashekar, HI, Murthy, IK, Sudha, P, Ostwald, M","2010","Carbon sequestration versus bioenergy: A case study from South India exploring the relative land-use efficiency of two options for climate change mitigation","30 year period"
"142","Anjum, SA, Wang, LC, Xue, LL, Saleem, MF, Wang, GX, Zou, CM","2010","Desertification in Pakistan: Causes, impacts and management","not applicable"
"143","Olschewski, R, Klein, AM, Tscharntke, T","2010","Economic trade-offs between carbon sequestration, timber production, and crop pollination in tropical forested landscapes",NA
"144","Liao, CZ, Fang, CM, Luo, YQ, Li, B","2010","Ecosystem Carbon Stock Influenced by Plantation Practice: Implications for Planting Forests as a Measure of Climate Change Mitigation","various"
"145","Moore, JC, Jevrejeva, S, Grinsted, A","2010","Efficacy of geoengineering to limit 21st century sea-level rise","2050"
"146","Lohila, A, Minkkinen, K, Laine, J, Savolainen, I, Tuovinen, JP, Korhonen, L, Laurila, T, Tietavainen, H, Laaksonen, A","2010","Forestation of boreal peatlands: Impacts of changing albedo and greenhouse gas fluxes on radiative forcing","not applicable"
"147","Schwaiger, HP, Bird, DN","2010","Integration of albedo effects caused by land use change into the climate balance: Should we still account in greenhouse gas units?",NA
"148","Jackson, RB, Baker, JS","2010","Opportunities and Constraints for Forest Climate Mitigation","2030"
"149","Chakraborty, D","2010","Small holder's carbon forestry project in Haryana India: issues and challenges","project duration of 20 years"
