"","X1","X2","X3","Data categorisation"
"389","Zeebe & Archer","2005","Feasibility of ocean fertilization and its impact on future atmospheric CO2 levels",NA
"390","Bakker et al","2005","Iron and mixing affect biological carbon uptake in SOIREE and EisenEx, two Southern Ocean iron fertilisation experiments",NA
"391","Lenton & Vaughan","2009","The radiative forcing potential of different climate geoengineering options",NA
"392","Strong et al","2009","Ocean fertilization: time to move on",NA
"393","Bertram","2010","Ocean iron fertilization in the context of the Kyoto protocol and the post-Kyoto process",NA
"394","Oschlies et al","2010","Climate engineering by artificial ocean upwelling: Channelling the sorcerer's apprentice",NA
"395","Rickels et al","2012","Economic prospects of ocean iron fertilization in an international carbon market",NA
"396","Russell et al","2012","Ecosystem Impacts of Geoengineering: A Review for Developing a Science Plan",NA
"398","Caldeira et al","2013","The science of geoengineering",NA
"399","Keller et al","2014","Potential climate engineering effectiveness and side effects during a high carbon dioxide-emission scenario",NA
"401","Jones","2014","The cost of carbon management using ocean nourishment",NA
"402","Bozec, Y, Bakker, DCE, Hartmann, C, Thomas, H, Bellerby, RGJ, Nightingale, PD, Riebesell, U, Watson, AJ, de Baar, HJW","2005","The CO2 system in a Redfield context during an iron enrichment experiment in the Southern Ocean","2005"
"403","Lomax, G; Workman, M; Lenton, T; Shah, N","2015","Reframing the policy approach to greenhouse gas removal technologies","2030"
"405","Woolf, D; Amonette, JE; Street-Perrott, FA; Lehmann, J; Joseph, S","2010","Sustainable biochar to mitigate global climate change","2100"
"406","Smith, P","2016","Soil carbon sequestration and biochar as negative emission technologies","2050"
"407","Roberts, KG; Gloy, BA; Scott, NR; Joseph, S; Lehmann, J","2010","Life Cycle Assessment of Biochar Systems: Estimating the Energetic, Economic, and Climate Change Potential","current"
"409","Powell, TWR; Lenton, TM","2012","Future carbon dioxide removal via biomass energy constrained by agricultural efficiency and dietary trends","2050"
"411","Lee, J.W.; Day, D.M.","2013","Smokeless biomass pyrolysis for producing biofuels and biochar as a possible arsenal to control climate change",NA
"412","Lee, JW; Hawkins, B; Day, DM; Reicosky, DC","2010","Sustainability: the capacity of smokeless biomass pyrolysis for energy production, global carbon capture and sequestration","current"
"413","Paustian, K; Lehmann, J; Ogle, S; Reay, D; Robertson, GP; Smith, P","2016","Climate-smart soils","2030"
"414","Pratt, K; Moran, D","2010","Evaluating the cost-effectiveness of global biochar mitigation potential","2030"
"416","Ilan Stavi &Rattan Lal","2013","Agroforestry and biochar to offset climate change: a review",NA
"417","Quilliam, RS; Rangecroft, S; Emmett, BA; Deluca, TH; Jones, DL","2013","Is biochar a source or sink for polycyclic aromatic hydrocarbon (PAH) compounds in agricultural soils?",NA
"418","Drake, JA; Carrucan, A; Jackson, WR; Cavagnaro, TR; Patti, AF","2015","Biochar application during reforestation alters species present and soil chemistry",NA
"419","Field, JL; Keske, CMH; Birch, GL; Defoort, MW; Cotrufo, MF","2013","Distributed biochar and bioenergy coproduction: a regionally specific case study of environmental benefits and economic impacts",NA
"420","Post, WM; Izaurralde, RC; West, TO; Liebig, MA; King, AW","2012","Management opportunities for enhancing terrestrial carbon dioxide sinks",NA
"421","Downie, AE; Van Zwieten, L; Smernik, RJ; Morris, S; Munroe, PR","2011","Terra Preta Australis: Reassessing the carbon storage capacity of temperate soils",NA
"422","Dai, LC; Li, H; Tan, FR; Zhu, NM; He, MX; He, MX; Hu, GQ","2016","Biochar: a potential route for recycling of phosphorus in agricultural residues",NA
"423","Hernandez-Soriano, MC; Hernandez-Soriano, MC; Kerre, B; Goos, P; Hardy, B; Dufey, J; Smolders, E","2016","Long-term effect of biochar on the stabilization of recent carbon: soils with historical inputs of charcoal",NA
"424","Bruckman, V.J.; Terada, T.; Uzun, B.B.; Apaydin-Varol, E.; Liu, J.","2015","Biochar for Climate Change Mitigation: Tracing the in-situ Priming Effect on a Forest Site",NA
"425","Kauffman, N; Dumortier, J; Hayes, DJ; Brown, RC; Laird, DA","2014","Producing energy while sequestering carbon? The relationship between biochar and agricultural productivity","2040"
"426","Gurwick, NP; Moore, LA; Kelly, C; Elias, P","2013","A Systematic Review of Biochar Research, with a Focus on Its Stability in situ and Its Promise as a Climate Mitigation Strategy",NA
"427","Naisse, C; Girardin, C; Lefevre, R; Pozzi, A; Maas, R; Stark, A; Rumpel, C","2015","Effect of physical weathering on the carbon sequestration potential of biochars and hydrochars in soil",NA
"428","Bach, M; Wilske, B; Breuer, L","2016","Current economic obstacles to biochar use in agriculture and climate change mitigation",NA
"429","Yoder, JK; Galinato, SP; Granatstein, D","2011","The economic value of biochar in crop production and carbon sequestration",NA
"430","Sheng, YQ; Zhan, Y; Zhu, LZ","2016","Reduced carbon sequestration potential of biochar in acidic soil",NA
"431","Viger, M; Hancock, RD; Miglietta, F; Miglietta, F; Taylor, G","2015","More plant growth but less plant defence? First global gene expression data for plants grown in soil amended with biochar",NA
"432","Crane-Droesch, A; Abiven, S; Jeffery, S; Torn, MS","2013","Heterogeneous global crop yield response to biochar: a meta-regression analysis",NA
"433","Brassard, P; Godbout, S; Raghavan, V","2016","Soil biochar amendment as a climate change mitigation tool: Key parameters and mechanisms involved",NA
"434","Downie, A; Lau, D; Cowie, A; Munroe, P",NA,"Approaches to greenhouse gas accounting methods for biomass carbon",NA
"435","Thomas, SC; Gale, N","2013","Biochar and forest restoration: a review and meta-analysis of tree growth responses","current"
"436","Meyer, S; Glaser, B; Quicker, P","2011","Technical, Economical, and Climate-Related Aspects of Biochar Production Technologies: A Literature Review",NA
"437","Thomazini, A; Spokas, K; Hall, K; Ippolito, J; Lentz, R; Novak, J","2015","GHG impacts of biochar: Predictability for the same biochar",NA
"438","Chen, J; Kim, H; Yoo, G","2015","Effects of Biochar Addition on CO2 and N2O Emissions following Fertilizer Application to a Cultivated Grassland Soil",NA
"439","Herath, HMSK; Camps-Arbestain, M; Hedley, MJ; Kirschbaum, MUF; Wang, T; van Hale, R","2015","Experimental evidence for sequestering C with biochar by avoidance of CO2 emissions from original feedstock and protection of native soil organic matter",NA
"440","Jeffery, S; Bezemer, TM; Cornelissen, G; Kuyper, TW; Lehmann, J; Mommer, L; Sohi, SP; van de Voorde, TFJ; Wardle, DA; van Groenigen, JW","2015","The way forward in biochar research: targeting trade-offs between the potential wins",NA
"441","Woolf, D; Lehmann, J; Lee, DR","2016","Optimal bioenergy power generation for climate change mitigation with or without carbon sequestration",NA
"442","Shackley, S; Hammond, J; Gaunt, J; Ibarrola, R","2011","The feasibility and costs of biochar deployment in the UK","current"
"443","Wang, JY; Xiong, ZQ; Kuzyakov, Y","2016","Biochar stability in soil: meta-analysis of decomposition and priming effects",NA
"444","Biederman, LA; Harpole, WS","2013","Biochar and its effects on plant productivity and nutrient cycling: a meta-analysis",NA
"445","McGlashan, N; Caldecott, B; Shah, N; Workman, M","2012","High-level techno-economic assessment of negative emissions technologies",NA
"446","Fang, Y.; Singh, B.P.; Krull, E","2014","Biochar carbon stability in four contrasting soils",NA
"447","Whitman, T; Lehmann, J","2009","Biochar-One way forward for soil carbon in offset mechanisms in Africa?",NA
"449","Criscuoli, I; Alberti, G; Baronti, S; Favilli, F; Martinez, C; Calzolari, C; Pusceddu, E; Rumpel, C; Viola, R; Miglietta, F","2014","Carbon Sequestration and Fertility after Centennial Time Scale Incorporation of Charcoal into Soil",NA
"450","Spokas, KA; Cantrell, KB; Novak, JM; Archer, DW; Ippolito, JA; Collins, HP; Boateng, AA; Lima, IM; Lamb, MC; McAloon, AJ; Lentz, RD; Nichols, KA","2012","Biochar: A Synthesis of Its Agronomic Impact beyond Carbon Sequestration",NA
"451","Omondi, MO; Xia, X; Nahayo, A; Liu, XY; Korai, PK; Pan, GX","2016","Quantification of biochar effects on soil hydrological properties using meta-analysis of literature data",NA
"452","Vochozka, M; Marouskova, A; Vachal, J; Strakova, J","2016","Biochar pricing hampers biochar farming",NA
"453","Cross, A; Sohi, SP","2013","A method for screening the relative long-term stability of biochar",NA
"454","Nanda, S; Reddy, SN; Mitra, SK; Kozinski, JA","2016","The progressive routes for carbon capture and sequestration",NA
"455","Zimmermann, M; Bird, MI; Wurster, C; Saiz, G; Goodrick, I; Barta, J; Capek, P; Santruckova, H; Smernik, R","2012","Rapid degradation of pyrogenic carbon",NA
"457","Sohi, SP","2012","Carbon Storage with Benefits",NA
"458","Jeffery, S; Verheijen, FGA; Kammann, C; Abalos, D","2016","Biochar effects on methane emissions from soils: A meta-analysis",NA
"459","Dickinson, D; Balduccio, L; Buysse, J; Ronsse, F; van Huylenbroeck, G; Prins, W","2015","Cost-benefit analysis of using biochar to improve cereals agriculture",NA
"460","Schimmelpfennig, S; Muller, C; Grunhage, L; Koch, C; Kammann, C","2014","Biochar, hydrochar and uncarbonized feedstock application to permanent grassland-Effects on greenhouse gas emissions and plant growth",NA
"461","Aller, MF","2016","Biochar properties: Transport, fate, and impact",NA
"462","Plaza, C; Giannetta, B; Fernandez, JM; Lopez-de-Sa, EG; Polo, A; Gasco, G; Mendez, A; Zaccone, C","2016","Response of different soil organic matter pools to biochar and organic fertilizers",NA
"463","Kuppusamy, S; Thavamani, P; Megharaj, M; Venkateswarlu, K; Naidu, R","2016","Agronomic and remedial benefits and risks of applying biochar to soil: Current knowledge and future research directions",NA
"464","Bass, AM; Bird, MI; Kay, G; Muirhead, B","2016","Soil properties, greenhouse gas emissions and crop yield under compost, biochar and co-composted biochar in two tropical agronomic systems",NA
"465","Cozier, M","2014","China's 1st 2nd generation biorefinery",NA
"466","Woolf, D; Lehmann, J","2012","Modelling the long-term response to positive and negative priming of soil organic carbon by black carbon",NA
"467","Mata, L; Cole, AJ; Paul, NA; de Nys, R","2014","Using CO2 to enhance carbon capture and biomass applications of freshwater macroalgae",NA
"468","Verma, M.; M'Hamdi, N.; Dkhili, Z.; Brar, S.K.; Misra, K.","2014","Thermochemical transformation of agro-biomass into biochar: Simultaneous carbon sequestration and soil amendment",NA
"469","Lorenz, K; Lal, R","2014","Biochar application to soil for climate change mitigation by soil organic carbon sequestration",NA
"470","Dang, Q; Wright, MM; Brown, RC","2015","Ultra-Low Carbon Emissions from Coal-Fired Power Plants through Bio-Oil Co-Firing and Biochar Sequestration",NA
"471","Liang, CF; Zhu, XL; Fu, SL; Mendez, A; Gasco, G; Paz-Ferreiro, J","2014","Biochar alters the resistance and resilience to drought in a tropical soil",NA
"472","Bruun, EW; Muller-Stover, D; Ambus, P; Hauggaard-Nielsen, H","2011","Application of biochar to soil and N2O emissions: potential effects of blending fast-pyrolysis biochar with anaerobically digested slurry",NA
"473","Macias, F; Arbestain, MC","2010","Soil carbon sequestration in a changing global environment",NA
"474","Bamminger, C; Poll, C; Sixt, C; Hogy, P; Wust, D; Kandeler, E; Marhan, S","2016","Short-term response of soil microorganisms to biochar addition in a temperate agroecosystem under soil warming",NA
"475","Glaser, B; Birk, JJ","2012","State of the scientific knowledge on properties and genesis of Anthropogenic Dark Earths in Central Amazonia (terra preta de Indio)",NA
"476","Han, XG; Sun, X; Wang, C; Wu, MX; Dong, D; Zhong, T; Thies, JE; Wu, WX","2016","Mitigating methane emission from paddy soil with rice-straw biochar amendment under projected climate change",NA
"477","Jones, DL; Quilliam RS","2014","Metal contaminated biochar and wood ash negatively affect plant growth and soil quality after land application",NA
"478","Jiang, X; Denef, K; Stewart, CE; Cotrufo, M.F.","2016","Controls and dynamics of biochar decomposition and soil microbial abundance, composition, and carbon use efficiency during long-term biochar-amended soil incubations",NA
"479","Bozzi, E; Genesio, L; Toscano, P; Pieri, M; Miglietta, F","2015","Mimicking biochar-albedo feedback in complex Mediterranean agricultural landscapes",NA
"480","Puga, AP; Abreu, CA; Melo, LCA; Beesley, L","2015","Biochar application to a contaminated soil reduces the availability and plant uptake of zinc, lead and cadmium",NA
"481","Buss, W; Masek, O; Graham, M; Wüst, D","2015","Inherent organic compounds in biochar-Their content, composition and potential toxic effects",NA
"482","Zhang, DX; Yan, M; Niu, YR; Liu, XY; van Zwieten, L; Chen, D; Bian, RJ; Cheng, K; Li, LQ; Joseph, S; Zheng, JW; Zhang, XH; Zheng, JF; Crowley, D; Filley, TR; Pan, GX","2016","Is current biochar research addressing global soil constraints for sustainable agriculture?",NA
"483","Xie, T; Reddy, KR; Wang, C; Yargicoglu, E; Spokas, K","2015","Characteristics and Applications of Biochar for Environmental Remediation: A Review",NA
"484","Batjes, N.H. (2004) Estimation of soil carbon gains upon improved management within croplands and grasslands of Africa","2004","http://dx.doi.org/10.1023/B:ENVI.0000003633.14591.fd",NA
"485","Shi, J., Liu, J., Gao, Z., Cui, L. (2005) A review on the influence of afforestation on soil carbon storage","2005","http://dx.doi.org/None",NA
"486","Hediger, W. (2006) Modeling GHG emissions and carbon sequestration in Swiss agriculture: An integrated economic approach","2006","http://dx.doi.org/10.1016/j.ics.2006.02.001",NA
"492","BrandÃ£o, M., Clift, R., MilÃ , L.C., Basson, L. (2010) A life-cycle approach to characterising environmental and economic impacts of multifunctional land-use systems: An integrated assessment in the UK","2010","http://dx.doi.org/10.3390/su2123747",NA
"493","Gupta, S., Struyk, A., Gilbert, D. (2011) Carbon sequestration from waste through conversion to charcoal: Equipment for a small-scale operation","2011","https://doi.org/10.2118/136887-PA",NA
"494","Si, J., Jia, L.-M., Wei, Y.-K., Xing, C.-S., Liu, S.-Q., Guo, Z.-X. (2012) Carbon storage in fast-growing and high-yield poplar plantations under subsurface drip irrigation","2012","https://www.cabdirect.org/cabdirect/abstract/20123156780",NA
"495","Zhang, M., Wei, Y., Kong, F., Chen, F., Zhang, H. (2012) Effects of tillage practices on soil carbon storage and greenhouse gas emission of farmland in North China","2012","http://dx.doi.org/10.3969/j.issn.1002-6819.2012.06.033",NA
"496","de Souza, J.L., Prezotti, L.C., AndrÃ© GuarÃ§oni, M. (2012) Carbon sequestration potential in agricultural soils under organic management to reduce greenhouse effect gas emissions","2012","http://dx.doi.org/10.4067/S0718-34292012000100002",NA
"499","Price, S.P., Bradford, M.A., Ashton, M.S. (2012) Characterizing organic carbon stocks and flows in forest soils","2012","http://dx.doi.org/10.1007/978-94-007-2232-3_2",NA
"500","Diacono, M., Montemurro, F. (2009) Long-term effects of organic amendments on soil fertility","2009","http://dx.doi.org/10.1007/978-94-007-0394-0_34",NA
"501","Hu, H., Liu, G. (2013) Dynamics of soil physical-chemical properties and organic carbon content along a restoration chronosequence in Pinus tabulaeformis plantations","2013","http://dx.doi.org/10.5846/stxb201112091888",NA
"502","Kareh, H.A., Naseri, H.R., Heshmati, G.H.A. (2013) Comparison of carbon sequestration quantity in haloxylon aphyllum and Stipagrostis plumosa in Iran Desert Area","2013","http://dx.doi.org/10.5829/idosi.wasj.2013.21.8.2864",NA
"505","He, S., Xie, J., Zeng, H., Tian, H., Zhou, Y., Xu, C., LÃ¼, M., Yang, Y. (2013) Dynamic of soil organic carbon pool after restoration of Pinus massoniana in eroded red soil area","2013","http://dx.doi.org/10.5846/stxb201205180742",NA
"508","Lal, R. (2008) Carbon sequestration in soil","2008","http://dx.doi.org/10.1079/PAVSNNR20083030",NA
"509","Lal, R. (2013) Intensive Agriculture and the Soil Carbon Pool","2013","http://dx.doi.org/10.1080/15427528.2013.845053","25-50 years"
"510","Chen, Q., Shen, C., Sun, Y., Peng, S., Yi, W., Li, Z., Jiang, M. (2008) Soil carbon dynamics in a subtropical mountainous region, south china: Results based on carbon isotopic tracing","2008","http://dx.doi.org/10.1007/978-3-540-77686-4_9",NA
"512","Torri, S.I., CorrÃªa, R.S., Renella, G. (2014) Soil carbon sequestration resulting from biosolids application","2014","http://dx.doi.org/10.1155/2014/821768",NA
"513","Poudyal, B.K., Poudel, P. (2013) Beneficial microbes ""jeevatu"" for biodegradable waste management and plant disease control","2013","http://dx.doi.org/10.1109/GHTC.2013.6713686",NA
"517","Bernoux, M., Cerri, C.C., Cerri, C.E.P., Neto, M.S., Metay, A., Perrin, A.-S., Scopel, E., Tantely, R., Blavet, D., De Piccolo, M.C., Pavei, M., Milne, E. (2009) Cropping systems, carbon sequestration and erosion in Brazil: A review","2009","http://dx.doi.org/10.1007/978-90-481-2666-8_7",NA
"518","Å imanskÃ½, V., KovÃ¡Äik, P. (2014) Carbon sequestration and its dynamics in water-stable aggregates","2014","http://dx.doi.org/10.2478/agri-2014-0001",NA
"519","Oladele, O., Braimoh, A. (2014) Potential of agricultural land management activities for increased soil carbon sequestration in Africa- a review","2014","http://dx.doi.org/10.15666/aeer/1203_741751",NA
"521","Qin, X., Li, Y., Wang, H., Li, J., Wan, Y., Liao, Y., Fan, M., Zhu, J., Gao, Q., Liu, S. (2015) Impact of biochar amendment on carbon emissions intensity in double rice field in South China","2015","http://dx.doi.org/10.3969/j.issn.1002-6819.2015.05.032",NA
"522","Chinade, A.A., Siwar, C., Ismail, S.M., Isahak, A. (2015) A review on carbon sequestration in Malaysian forest soils: Opportunities and barriers","2015","http://dx.doi.org/10.3923/ijss.2015.17.27",NA
"524","Wen, W., Zhou, B.T., Wang, Y.F., Liang, D. (2015) Effects of spatio-temporal changes of land-use on soil organic carbon in yangjuangou watershed in Loess Plateau, China","2015","http://dx.doi.org/10.5846/stxb201401250188",NA
"525","Srinivasarao, C., Lal, R., Kundu, S., Thakur, P.B. (2015) Conservation agriculture and soil carbon sequestration","2015","http://dx.doi.org/10.1007/978-3-319-11620-4_19",NA
"526","Lal, R., Lorenz, K. (2012) Carbon sequestration in temperate forests","2012","http://dx.doi.org/10.1007/978-94-007-4159-1_9",NA
"527","Miao, S., Qiao, Y., Zhang, F. (2015) Conversion of cropland to grassland and forest mitigates global warming potential in northeast China","2015","http://dx.doi.org/10.15244/pjoes/33928",NA
"531","Gerber, P.J. (2017) Climate change mitigation and productivity gains in livestock supply chains: insights from regional case studies","2017","http://dx.doi.org/10.1007/s10113-016-0986-3",NA
"532","Sumiyoshi, Y., Crow, S.E., Litton, C.M., Deenik, J.L., Taylor, A.D., Turano, B., Ogoshi, R. (2016) Belowground impacts of perennial grass cultivation for sustainable biofuel feedstock production in the tropics","2016","http://dx.doi.org/10.1111/gcbb.12379",NA
"533","Lu, X., Liao, Y. (2016) Effect of tillage practices on net carbon flux and economic parameters from farmland on the Loess Plateau in China","2016","http://dx.doi.org/10.1016/j.jclepro.2016.09.044",NA
"534","Bos, J.F.F.P., ten Berge, H.F.M., Verhagen, J., van Ittersum, M.K. (2016) Trade-offs in soil fertility management on arable farms","2016","http://dx.doi.org/10.1016/j.agsy.2016.09.013",NA
"535","LAL, R. (2017) Effects of Tillage Practices and Land Use Management on Soil Aggregates and Soil Organic Carbon in the North Appalachian Region, USA","2017","http://dx.doi.org/10.1016/S1002-0160(17)60301-1",NA
"536","Hosseiniaghdam, E.S., Bahrami, B., Ghorbani, A., Hosseiniaghdam, S.S., Mohseni, A. (2016) Response of soil organic matter to changes in the differing intensities of grazing in semi-arid rangelands in Iran","2016","http://dx.doi.org/10.13031/aim.20162430448",NA
"537","Winowiecki, L. (2017) Soil carbon 4 per mille","2017","http://dx.doi.org/10.1016/j.geoderma.2017.01.002",NA
"538","Xiong, Y.-C. (2017) Ridge-furrow plastic-mulching with balanced fertilization in rainfed maize (Zea mays L.): An adaptive management in east African Plateau","2017","http://dx.doi.org/10.1016/j.agrformet.2017.01.014",NA
"539","Wu, G. (2017) Leguminous species sequester more carbon than gramineous species in cultivated grasslands of a semi-arid area","2017","http://dx.doi.org/10.5194/se-8-83-2017",NA
"540","Parajuli, R., Knudsen, M.T., Djomo, S.N., Corona, A., Birkved, M., Dalgaard, T. (2017) Environmental life cycle assessment of producing willow, alfalfa and straw from spring barley as feedstocks for bioenergy or biorefinery systems","2017","http://dx.doi.org/10.1016/j.scitotenv.2017.01.207",NA
"541","Li, D. (2017) Impacts of vegetation restoration strategies on soil organic carbon and nitrogen dynamics in a karst area, southwest China","2017","http://dx.doi.org/10.1016/j.ecoleng.2017.01.037",NA
"542","Weindorf, D. (2017) Soil carbon sequestration potential in semi-arid grasslands in the Conservation Reserve Program","2017","http://dx.doi.org/10.1016/j.geoderma.2017.01.032",NA
"544","Batjes, NH (1998) Mitigation of atmospheric CO(2) concentrations by increased carbon sequestration in the soil","1998","http://dx.doi.org/10.1007/s003740050425",NA
"547","Metting, FB, Smith, JL, Amthor, JS, Izaurralde, RC (2001) Science needs and new technology for increasing soil carbon sequestration","2001","http://dx.doi.org/10.1023/A:1017509224801","50 to 100 yrs"
"548","Jo, HK (2002) Impacts of urban greenspace on offsetting carbon emissions for middle Korea","2002","http://dx.doi.org/10.1006/jema.2001.0491",NA
"549","Owens, LB, Malone, RW, Hothem, DL, Starr, GC, Lal, R (2002) Sediment carbon concentration and transport from small watersheds under various conservation tillage practices","2002","http://dx.doi.org/10.1016/S0167-1987(02)00031-4",NA
"552","Olsson, L, Ardo, J (2002) Soil carbon sequestration in degraded semiarid agro-ecosystems - Perils and Potentials","2002","http://dx.doi.org/10.1639/0044-7447(2002)031[0471:SCSIDS]2.0.CO;2",NA
"553","Sperow, M, Eve, M, Paustian, K (2003) Potential soil C sequestration on US agricultural soils","2003","http://dx.doi.org/10.1023/A:1022888832630","15 years"
"554","Lal, R (2003) Global potential of soil carbon sequestration to mitigate the greenhouse effect","2003","http://dx.doi.org/10.1080/713610854","50 years"
"555","Lal, R (2003) Offsetting global CO2 emissions by restoration of degraded soils and intensification of world agriculture and forestry","2003","http://dx.doi.org/10.1002/ldr.562",NA
"556","Ogle, SM, Breidt, FJ, Eve, MD, Paustian, K (2003) Uncertainty in estimating land use and management impacts on soil organic carbon storage for US agricultural lands between 1982 and 1997","2003","http://dx.doi.org/10.1046/j.1529-8817.2003.00683.x",NA
"560","Lal, R (2004) Soil carbon sequestration impacts on global climate change and food security","2004","http://dx.doi.org/10.1126/science.1097396",NA
"561","Ogle, SM, Conant, RT, Paustian, K (2004) Deriving grassland management factors for a carbon accounting method developed by the intergovernmental panel on climate change","2004","http://dx.doi.org/10.1007/s00267-003-9105-6","20 years"
"562","Lal, R (2004) Offsetting China's CO2 emissions by soil carbon sequestration","2004","http://dx.doi.org/10.1023/B:CLIM.0000038203.81854.7c","50 years"
"563","Lal, R (2004) Soil carbon sequestration in India","2004","http://dx.doi.org/10.1023/B:CLIM.0000038202.46720.37",NA
"564","Tieszen, LL, Tappan, GG, Toure, A (2004) Sequestration of Carbon in Soil Organic Matter in Senegal: an overview","2004","http://dx.doi.org/10.1016/j.jaridenv.2004.04.002",NA
"565","Tschakert, P, Khouma, M, Sene, M (2004) Biophysical potential for soil carbon sequestration in agricultural systems of the Old Peanut Basin of Senegal","2004","http://dx.doi.org/10.1016/j.jaridenv.2004.03.026",NA
"566","Lal, R (2004) Carbon sequestration in soils of central Asia","2004","http://dx.doi.org/10.1002/ldr.624","50 years"
"567","Wang, SQ, Liu, JY, Yu, GR, Pan, YY, Chen, QM, Li, KR, Li, JY (2004) Effects of land use change on the storage of soil organic carbon: A case study of the Qianyanzhou Forest Experimental Station in China","2004","http://dx.doi.org/10.1007/s10584-004-2847-1","14 years"
"568","Vagen, TG, Lal, R, Singh, BR (2005) Soil carbon sequestration in sub-Saharan Africa: A review","2005","http://dx.doi.org/10.1002/ldr.644",NA
"569","Ogle, SM, Breidt, FJ, Paustian, K (2005) Agricultural management impacts on soil organic carbon storage under moist and dry climatic conditions of temperate and tropical regions","2005","http://dx.doi.org/10.1007/s10533-004-0360-2",NA
"570","Conant, RT, Paustian, K, Del Grosso, SJ, Parton, WJ (2005) Nitrogen pools and fluxes in grassland soils sequestering carbon","2005","http://dx.doi.org/10.1007/s10705-004-5085-z",NA
"571","Desjardins, RL, Smith, W, Grant, B, Campbell, C, Riznek, R (2005) Management strategies to sequester carbon in agricultural soils and to mitigate greenhouse gas emissions","2005","http://dx.doi.org/10.1007/s10584-005-5951-y","30 year"
"572","Rees, RM, Bingham, IJ, Baddeley, JA, Watson, CA (2005) The role of plants and land management in sequestering soil carbon in temperate arable and grassland ecosystems","2005","http://dx.doi.org/10.1016/j.geoderma.2004.12.020",NA
